"Title","Journal","Year","Authors","DOI","PMID","Abstract"
"A comprehensive survey on high-definition map generation and maintenance","ISPRS INTERNATIONAL JOURNAL OF GEO-INFORMATION","2024","Asrat, Kaleab Taye; Cho, Hyung-Ju","10.3390/ijgi13070232","41282813","Abstract

UNLABELLED
Plasmids are extrachromosomal mobile genetic elements that often carry genes responsible for antimicrobial resistance. Plasmid epidemiology aims to track the evolution and spread of plasmids, but the field currently faces significant barriers that make practical implementation using whole genome sequence data difficult. Hybrid-assembled genomes remain the most reliable way to identify and track complete plasmids; however, most genomic surveillance data exists in the form of short-read sequencing, which lacks the resolution required to accurately resolve plasmids. Despite recent advances, long-read-only assemblies have not yet reached the consistency seen in hybrid assemblies. The ideal approach to plasmid epidemiology using whole genome sequence data would consider the limitations of sequencing technologies and the constraints of existing genomic surveillance infrastructure, in addition to the unique evolutionary biology of plasmids. Here, we present ACCIO (Assembly-based Circular Contig Identification for Outbreaks), a tool which creates a reference plasmid database and uses it to infer which plasmids, and genetically related plasmid groupings, are present in an input assembly (Illumina, Nanopore, or hybrid assembly). We validated ACCIO using an internal dataset of 303 plasmid-harboring bacterial clinical and surveillance isolates collected from a single acute tertiary care center. When highly related database plasmids were grouped together, ACCIO achieved 100% sensitivity and 92.1% positive predictive value (PPV) for detection of plasmid groups using hybrid assemblies, and comparably strong performance for Illumina (93.0% sensitivity, 86.6% PPV) and Nanopore (79.3% sensitivity, 91.4% PPV) assemblies. Evaluation on three external datasets yielded consistently high performance. Finally, when benchmarked against MOB-suite, a tool for reconstruction and typing of plasmids, ACCIO demonstrated superior performance across nearly all assembly types and plasmid grouping levels. By integrating database construction, clustering, and plasmid calling into a single workflow compatible with all major sequencing platforms, ACCIO is intended to help advance plasmid epidemiology beyond its current technological and infrastructural barriers.

IMPACT STATEMENT
3.Detecting and tracking plasmids-the mobile genetic elements often responsible for spreading antimicrobial resistance in hospital settings-is challenging, particularly when relying on short-read sequencing data alone. Short-read genome assemblies, despite widespread use in surveillance of bacterial pathogens, inherently lack the resolution required for plasmid analyses. Current bioinformatic methods struggle to identify whole plasmids from short-read assemblies alone, and often, hybrid assembly using both short- and long-read data is required for the robust analyses that are essential for tracking plasmids.To address these challenges, we developed ACCIO, a bioinformatics tool which utilizes input genome assemblies (short-read, long-read, or hybrid assemblies) to assess the plasmid content of clinical bacterial isolates for epidemiologic purposes. We validated its use against the recovery of circular plasmid sequences from hybrid assembled genomes as a gold standard method for determining plasmid content. Using a curated local database of 430 plasmid sequences, ACCIO provided accurate inferences of plasmid content from short-read (Illumina), long-read (Oxford Nanopore Technologies), and hybrid assemblies (both), ultimately facilitating genomic surveillance of plasmids regardless of sequencing technology. This work represents a meaningful step forward in advancing plasmid surveillance beyond the technological and infrastructural barriers that limit its broader expansion into healthcare and other settings.

DATA SUMMARY
4.Short- and long-read sequencing data have been deposited in the NCBI Sequence Read Archive (SRA) under multiple BioProjects, and corresponding hybrid genome assemblies are available in GenBank. Accession numbers for all BioProjects, BioSamples, and SRA datasets are provided in Supplementary Data S1. All supporting data, software code, and experimental/analysis protocols are provided within the article or in supplementary data files. External validation of ACCIO used three external datasets (Cho et al. 2023, BioProjects PRJNA475751 and PRJNA874473, DOI: 10.1038/s41598-024-70540-1; Lipworth et al. 2024, BioProject: PRJNA604975, DOI: 10.1038/s41467-024-45761-7; Khezri et al. 2021, European Nucleotide Archive (ENA): PRJEB45084, DOI: 10.3390/microorganisms9122560).List of External Software:: MOB-suite (v3.1.9) - https://github.com/phac-nml/mob-suite Skani (v0.2.2) - https://github.com/bluenote-1577/skani Scipy (v1.16.1) - https://github.com/scipy/scipy Pling (v2.0.0) - https://github.com/iqbal-lab-org/pling MUMmer / NUCmer (v4.0.1) - https://mummer4.github.io/ Mash / Mash Screen (v2.3) - https://github.com/marbl/Mash SPAdes (v3.15.5) - https://github.com/ablab/spades Unicycler (v0.5.1) - https://github.com/rrwick/Unicycler Flye (v2.9.5) - https://github.com/mikolmogorov/Flye QUAST (v5.2.0) - https://github.com/ablab/quast Kraken2 (v2.1.3) - https://github.com/DerrickWood/kraken2 CheckM (v0.4) - https://github.com/Ecogenomics/CheckM Albacore/Guppy - [no longer officially hosted; was distributed by ONT] Guppy - https://nanoporetech.com/software/other/guppy Dorado - https://github.com/nanoporetech/dorado Bowtie2 (v2.5.4) - https://github.com/BenLangmead/bowtie2 Minimap2 (v2.28) - https://github.com/lh3/minimap2 Biopython (v1.85) - https://biopython.org/ Pandas (v2.3.1) - https://pandas.pydata.org/ Plasme (v1.1) - https://github.com/HubertTang/PLASMe BLAST(v2.17.0) - https://blast.ncbi.nlm.nih.gov/Blast.cgi."
"Clothoid-Based Reference Path Reconstruction for HD Map Generation","IEEE TRANSACTIONS ON INTELLIGENT TRANSPORTATION SYSTEMS","2024","Zhang, Songyi; Wang, Runsheng; Jian, Zhiqiang; Zhan, Wei; Zheng, Nanning; Tomizuka, Masayoshi","10.1109/tits.2023.3305198","41116384","Building on the work of Almasan et al. [IEEE Trans. Netw. Sci. Eng. 12, 1649 (2025)10.1109/TNSE.2025.3537162], we propose a continuous-time Markov model for human contact dynamics denoted the continuous random walkers induced temporal graph model (CRWIG). In CRWIG, M walkers move randomly and independently of each other on a Markov graph with N nodes in continuous time. If walkers are in the same state (node of the Markov graph) at time t, a link is created between them in their temporal contact graph G(t), where each walker corresponds to one of the M nodes. We define the exact Markov governing equation that describes the movement of the ensemble of M walkers. We investigate the consequences of the time discretization of CRWIG. We prove that CRWIG is characterized by exponential decay of the initial condition and exponentially tailed intermeeting times of the walkers. We investigate two special cases of CRWIG and derive analytical results supported by simulations. We extend the model to allow for nonexponential sojourn times for the single walkers. The non-Markovian model extension of CRWIG is able to reproduce empirical properties of human mobility observed on data: arbitrary flight length distribution, arbitrary pause-time distribution, and intermeeting time distributions that are power-law with an exponential tail."
"Real-time trajectory planning for autonomous driving with gaussian process and incremental refinement","IET CONTROL THEORY & APPLICATIONS","2023","Lu, Yongkang; He, Shenghuang; Li, Yanzhou; Wu, Yuanqing; Zhong, Wenjian","10.1049/cth2.12397","40688697","[This retracts the article DOI: 10.1049/nbt2.12107.]."
"Train here, drive there: ROS based end-to-end autonomous-driving pipeline validation in CARLA simulator using the NHTSA typology","MULTIMEDIA TOOLS AND APPLICATIONS","2022","Gómez-Huélamo, Carlos; Del Egido, Javier; Bergasa, Luis M.; Barea, Rafael; López-Guillén, Elena; Arango, Felipe; Araluce, Javier; López, Joaquín","10.1007/s11042-021-11681-7","41287838","Abstract

UNLABELLED
Fifteen organochlorine pesticides (OCPs) were determined in sediments from 14 sites in upper, middle and lower reaches of River Rwizi. Duplicate samples were collected at each site, during three sampling regimes covering the wet and dry seasons. Sediments were extracted using acetone: hexane (1:1 mixture) and clean-up was achieved using C18 cartridge. OCPs were determined using gas chromatography-mass spectrometry (GC-MS). Principal component analysis (PCA) was used to assess spatial relationships. To assess ecological health risk, the risk quotient (RQ) based on exposure and toxicity was calculated. Hazard index (HI), based on the sum of ratios of the OCP doses to permitted levels was calculated assess risk to human health. Recoveries of 54.4-93%, linearity (R2) > 0.9988, limits of detection (LoD) of 0.34-0.66 ng/kg and limits of quantification (LoQ) of 1.02-2.01 ng/kg were obtained during method validation. The total OCPs concentration was 84.34-159.5 µg/kg dry weight. Presence of OCPs in the sediment may be attributed to environmental persistence, however the presence of endosulfans implies continuing input since they have a relatively short half-life. Ecological risk quotient (RQ) values were 0.01-9780.37 while hazard index (HI) values were all less than 1. The HI for dermal exposure in children was 0.2695 and in adults it was 0.1497, exceeding the negligible risk threshold of H < 0.1. While the risk to human health was low, the high risk posed to ecology by heptachlor (RQ = 9780.37) and endosulfan II (RQ = 835.98) requires immediate mitigation.

SUPPLEMENTARY INFORMATION
The online version contains supplementary material available at 10.1007/s44274-025-00465-7."
"Real-Time Optimization-Based Path Planning for Autonomous Semi-Trailer Trucks","INTELLIGENT SERVICE ROBOTICS","2022","Sabiha, Ahmed D.; Kamel, Mohamed A.; Said, Ehab; Hussein, Wessam M.","10.1007/s11370-022-00429-3","41287838","Abstract

UNLABELLED
Fifteen organochlorine pesticides (OCPs) were determined in sediments from 14 sites in upper, middle and lower reaches of River Rwizi. Duplicate samples were collected at each site, during three sampling regimes covering the wet and dry seasons. Sediments were extracted using acetone: hexane (1:1 mixture) and clean-up was achieved using C18 cartridge. OCPs were determined using gas chromatography-mass spectrometry (GC-MS). Principal component analysis (PCA) was used to assess spatial relationships. To assess ecological health risk, the risk quotient (RQ) based on exposure and toxicity was calculated. Hazard index (HI), based on the sum of ratios of the OCP doses to permitted levels was calculated assess risk to human health. Recoveries of 54.4-93%, linearity (R2) > 0.9988, limits of detection (LoD) of 0.34-0.66 ng/kg and limits of quantification (LoQ) of 1.02-2.01 ng/kg were obtained during method validation. The total OCPs concentration was 84.34-159.5 µg/kg dry weight. Presence of OCPs in the sediment may be attributed to environmental persistence, however the presence of endosulfans implies continuing input since they have a relatively short half-life. Ecological risk quotient (RQ) values were 0.01-9780.37 while hazard index (HI) values were all less than 1. The HI for dermal exposure in children was 0.2695 and in adults it was 0.1497, exceeding the negligible risk threshold of H < 0.1. While the risk to human health was low, the high risk posed to ecology by heptachlor (RQ = 9780.37) and endosulfan II (RQ = 835.98) requires immediate mitigation.

SUPPLEMENTARY INFORMATION
The online version contains supplementary material available at 10.1007/s44274-025-00465-7."
"Vision-based wearable steering assistance for people with impaired vision in jogging","IEEE INTERNET OF THINGS JOURNAL","2019","Jiang, Bin; Yang, Jiachen; Lv, Zhihan; Song, Houbing","10.1109/jiot.2018.2842229","41116384","Building on the work of Almasan et al. [IEEE Trans. Netw. Sci. Eng. 12, 1649 (2025)10.1109/TNSE.2025.3537162], we propose a continuous-time Markov model for human contact dynamics denoted the continuous random walkers induced temporal graph model (CRWIG). In CRWIG, M walkers move randomly and independently of each other on a Markov graph with N nodes in continuous time. If walkers are in the same state (node of the Markov graph) at time t, a link is created between them in their temporal contact graph G(t), where each walker corresponds to one of the M nodes. We define the exact Markov governing equation that describes the movement of the ensemble of M walkers. We investigate the consequences of the time discretization of CRWIG. We prove that CRWIG is characterized by exponential decay of the initial condition and exponentially tailed intermeeting times of the walkers. We investigate two special cases of CRWIG and derive analytical results supported by simulations. We extend the model to allow for nonexponential sojourn times for the single walkers. The non-Markovian model extension of CRWIG is able to reproduce empirical properties of human mobility observed on data: arbitrary flight length distribution, arbitrary pause-time distribution, and intermeeting time distributions that are power-law with an exponential tail."
"Intelligent vehicle decision-making and trajectory planning method based on deep reinforcement learning in the Frenet Space","SENSORS","2023","Wang, Jiawei; Chu, Liang; Zhang, Yao; Mao, Yabin; Guo, Chong","10.3390/s23249819","41240740","Driver fatigue poses a critical threat to global road safety, particularly among young drivers. Nevertheless, policy-level interventions remain fragmented due to the lack of reliable and deployable detection technologies. Bridging this gap requires accurate, interpretable, and real-time fatigue monitoring systems capable of informing practical decision-making in transportation safety management. To address this challenge, we propose an end-to-end EEG-based fatigue detection model, Scale-Enhanced Transformer and Dynamic Graph Convolutional Network (SET-DGCN). The model captures multi-scale temporal dependencies and spatial brain-region interactions by integrating convolutional embeddings, attention mechanisms, and learnable graph structures. Extensive evaluations on both a driving simulation dataset and the publicly available SEED-VIG dataset confirm that SET-DGCN outperforms mainstream convolutional neural network (CNN)-based, graph convolutional network (GCN)-based, and Transformer-based models in terms of accuracy and F1-score, while maintaining strong cross-subject generalization. To enhance both interpretability and application relevance, a component-level attribution method (COAR) is employed to evaluate the functional contribution of model modules, while SHapley Additive exPlanations (SHAP) analysis is used to uncover brain region-specific patterns across fatigue stages. Based on these neural insights, a set of multi-level policy and design recommendations is proposed, ranging from infrastructure enhancements to adaptive in-vehicle systems and individualized interventions, to provide a comprehensive framework for mitigating fatigue among young drivers in real-world transportation contexts."
"Multi-model-based local path planning methodology for autonomous driving: An integrated framework","IEEE TRANSACTIONS ON INTELLIGENT TRANSPORTATION SYSTEMS","2022","Jian, Zhiqiang; Chen, Shitao; Zhang, Songyi; Chen, Yu; Zheng, Nanning","10.1109/tits.2020.3042603","41116384","Building on the work of Almasan et al. [IEEE Trans. Netw. Sci. Eng. 12, 1649 (2025)10.1109/TNSE.2025.3537162], we propose a continuous-time Markov model for human contact dynamics denoted the continuous random walkers induced temporal graph model (CRWIG). In CRWIG, M walkers move randomly and independently of each other on a Markov graph with N nodes in continuous time. If walkers are in the same state (node of the Markov graph) at time t, a link is created between them in their temporal contact graph G(t), where each walker corresponds to one of the M nodes. We define the exact Markov governing equation that describes the movement of the ensemble of M walkers. We investigate the consequences of the time discretization of CRWIG. We prove that CRWIG is characterized by exponential decay of the initial condition and exponentially tailed intermeeting times of the walkers. We investigate two special cases of CRWIG and derive analytical results supported by simulations. We extend the model to allow for nonexponential sojourn times for the single walkers. The non-Markovian model extension of CRWIG is able to reproduce empirical properties of human mobility observed on data: arbitrary flight length distribution, arbitrary pause-time distribution, and intermeeting time distributions that are power-law with an exponential tail."
"Improving the generalizability of trajectory prediction models with frenet-based domain normalization","JOURNAL OF GUIDANCE, CONTROL, AND DYNAMICS","2004","Avanzini, Giulio","10.2514/1.9338","41195270","Abstract

INTRODUCTION
Accurate prediction of treatment response and prognosis in breast cancer patients is critical to advance personalized medicine and optimize therapeutic decision-making. Within the context of AI-enabled healthcare, there remains a pressing need to develop robust, interpretable models that can account for the temporal complexity and heterogeneity inherent in longitudinal patient data.

METHODS
This study proposes a novel framework designed to model patient-specific treatment trajectories using a dynamics-aware, deep sequence learning architecture. Aligned with the core themes of computational prognostics and precision therapy, our method addresses the challenges posed by variable patient responses, missing clinical records, and complex pharmacological interactions. Existing approaches, including conventional supervised learning and static classification models, often fall short in capturing the underlying temporal dependencies, multimodal data fusion, and counterfactual reasoning necessary for real-world clinical deployment. These limitations hinder generalizability, especially in scenarios where treatment outcomes are delayed or weakly annotated. In contrast, our approach integrates recurrent modeling, attention mechanisms, and uncertainty quantification to better capture the evolving nature of patient health trajectories. Moreover, we incorporate domain-informed regularization techniques and causal inference modules to improve interpretability and clinical relevance.

RESULTS AND DISCUSSION
By learning temporal dynamics in a personalized manner, the proposed model enhances predictive performance while remaining sensitive to patient-specific variations and therapeutic regimens. Through extensive validation on real-world breast cancer cohorts, we demonstrate that our framework not only outperforms existing baselines but also provides actionable insights that can inform adaptive treatment planning and risk stratification."
"A Graph-search based Trajectory Planning Approach with Longitudianl Priority","IEEE TRANSACTIONS ON CONTROL SYSTEMS TECHNOLOGY","2023","Scheffe, Patrick; Pedrosa, Matheus V. A.; Flaßkamp, Kathrin; Alrifaee, Bassam","10.1109/tcst.2022.3214718","41116384","Building on the work of Almasan et al. [IEEE Trans. Netw. Sci. Eng. 12, 1649 (2025)10.1109/TNSE.2025.3537162], we propose a continuous-time Markov model for human contact dynamics denoted the continuous random walkers induced temporal graph model (CRWIG). In CRWIG, M walkers move randomly and independently of each other on a Markov graph with N nodes in continuous time. If walkers are in the same state (node of the Markov graph) at time t, a link is created between them in their temporal contact graph G(t), where each walker corresponds to one of the M nodes. We define the exact Markov governing equation that describes the movement of the ensemble of M walkers. We investigate the consequences of the time discretization of CRWIG. We prove that CRWIG is characterized by exponential decay of the initial condition and exponentially tailed intermeeting times of the walkers. We investigate two special cases of CRWIG and derive analytical results supported by simulations. We extend the model to allow for nonexponential sojourn times for the single walkers. The non-Markovian model extension of CRWIG is able to reproduce empirical properties of human mobility observed on data: arbitrary flight length distribution, arbitrary pause-time distribution, and intermeeting time distributions that are power-law with an exponential tail."
"A survey of trajectory planning methods for autonomous driving—Part I: Unstructured scenarios","IEEE TRANSACTIONS ON INTELLIGENT VEHICLES","2024","Guo, Yuqing; Guo, Zelin; Wang, Yazhou; Yao, Danya; Li, Bai; Li, Li","10.1109/tiv.2023.3337318","41116384","Building on the work of Almasan et al. [IEEE Trans. Netw. Sci. Eng. 12, 1649 (2025)10.1109/TNSE.2025.3537162], we propose a continuous-time Markov model for human contact dynamics denoted the continuous random walkers induced temporal graph model (CRWIG). In CRWIG, M walkers move randomly and independently of each other on a Markov graph with N nodes in continuous time. If walkers are in the same state (node of the Markov graph) at time t, a link is created between them in their temporal contact graph G(t), where each walker corresponds to one of the M nodes. We define the exact Markov governing equation that describes the movement of the ensemble of M walkers. We investigate the consequences of the time discretization of CRWIG. We prove that CRWIG is characterized by exponential decay of the initial condition and exponentially tailed intermeeting times of the walkers. We investigate two special cases of CRWIG and derive analytical results supported by simulations. We extend the model to allow for nonexponential sojourn times for the single walkers. The non-Markovian model extension of CRWIG is able to reproduce empirical properties of human mobility observed on data: arbitrary flight length distribution, arbitrary pause-time distribution, and intermeeting time distributions that are power-law with an exponential tail."
"Fast trajectory path planning inspired by binary searching algorithm","ACTA ASTRONAUTICA","2010","Ceriotti, Matteo; Vasile, Massimiliano","10.1016/j.actaastro.2010.07.001","41285133",
"Optimization-based trajectory planning for autonomous parking with irregularly placed obstacles: A lightweight iterative framework","IEEE TRANSACTIONS ON INTELLIGENT TRANSPORTATION SYSTEMS","2022","Li, Bai; Acarman, Tankut; Zhang, Youmin; Ouyang, Yakun; Yaman, Cagdas; Kong, Qi; Zhong, Xiang; Peng, Xiaoyan","10.1109/tits.2021.3109011","41116384","Building on the work of Almasan et al. [IEEE Trans. Netw. Sci. Eng. 12, 1649 (2025)10.1109/TNSE.2025.3537162], we propose a continuous-time Markov model for human contact dynamics denoted the continuous random walkers induced temporal graph model (CRWIG). In CRWIG, M walkers move randomly and independently of each other on a Markov graph with N nodes in continuous time. If walkers are in the same state (node of the Markov graph) at time t, a link is created between them in their temporal contact graph G(t), where each walker corresponds to one of the M nodes. We define the exact Markov governing equation that describes the movement of the ensemble of M walkers. We investigate the consequences of the time discretization of CRWIG. We prove that CRWIG is characterized by exponential decay of the initial condition and exponentially tailed intermeeting times of the walkers. We investigate two special cases of CRWIG and derive analytical results supported by simulations. We extend the model to allow for nonexponential sojourn times for the single walkers. The non-Markovian model extension of CRWIG is able to reproduce empirical properties of human mobility observed on data: arbitrary flight length distribution, arbitrary pause-time distribution, and intermeeting time distributions that are power-law with an exponential tail."
