"Title","Journal","Year","Authors","DOI","PMID","Abstract"
"Hd Maps for Autonomous Vehicles: Challenges and Representing Frameworks","PRODUCTION ENGINEERING ARCHIVES","2017","Barsi, Arpad; Poto, Vivien; Somogyi, Arpad; Lovas, Tamas; Tihanyi, Viktor; Szalay, Zsolt","10.30657/pea.2017.16.09","40942942","High-definition (HD) maps are essential for safe and reliable autonomous driving, but their growing size and the need for real-time updates pose significant challenges for in-vehicle storage and communication efficiency. This study proposes a lightweight and scalable HD map provisioning system based on Geohash spatial indexing and Smart Roadside Units (Smart RSUs). The system divides HD map data into Geohash-based spatial blocks and enables vehicles to request only the map segments corresponding to their current location, reducing storage burden and communication load. To validate the system's effectiveness, we constructed a simulation environment where multiple vehicle clients simultaneously request map data from a Smart RSU. Experimental results showed that the proposed Geohash-based approach achieved an average response time (RTT) of 1244.82 ms-approximately 296.3% faster than the conventional GPS-based spatial query method-and improved database query performance by 1072.6%. Additionally, we demonstrate the system's scalability by adjusting Geohash levels according to road density, using finer blocks in urban areas and coarser blocks in rural areas. The hierarchical nature of Geohash also enables consistent integration of blocks with different resolutions. These results confirm that the proposed method provides an efficient and real-time HD map delivery framework suitable for dynamic and dense traffic environments."
"Monte Carlo Tree Search for Behavior Planning in Autonomous Driving","IEEE TRANSACTIONS ON VEHICULAR TECHNOLOGY","2020","Chen, Jienan; Zhang, Cong; Luo, Jinting; Xie, Junfei; Wan, Yan","10.1109/tvt.2020.2991584","41116384","Building on the work of Almasan et al. [IEEE Trans. Netw. Sci. Eng. 12, 1649 (2025)10.1109/TNSE.2025.3537162], we propose a continuous-time Markov model for human contact dynamics denoted the continuous random walkers induced temporal graph model (CRWIG). In CRWIG, M walkers move randomly and independently of each other on a Markov graph with N nodes in continuous time. If walkers are in the same state (node of the Markov graph) at time t, a link is created between them in their temporal contact graph G(t), where each walker corresponds to one of the M nodes. We define the exact Markov governing equation that describes the movement of the ensemble of M walkers. We investigate the consequences of the time discretization of CRWIG. We prove that CRWIG is characterized by exponential decay of the initial condition and exponentially tailed intermeeting times of the walkers. We investigate two special cases of CRWIG and derive analytical results supported by simulations. We extend the model to allow for nonexponential sojourn times for the single walkers. The non-Markovian model extension of CRWIG is able to reproduce empirical properties of human mobility observed on data: arbitrary flight length distribution, arbitrary pause-time distribution, and intermeeting time distributions that are power-law with an exponential tail."
"Automatic map generation for autonomous driving system testing","PROCEEDINGS OF THE ACM ON SOFTWARE ENGINEERING","2025","Tu, Zhi; Niu, Liangkun; Fan, Wei; Zhang, Tianyi","10.1145/3729348","37514797","Statistical learning techniques and increased computational power have facilitated the development of self-driving car technology. However, a limiting factor has been the high expense of scaling and maintaining high-definition (HD) maps. These maps are a crucial backbone for many approaches to self-driving technology. In response to this challenge, we present an approach that fuses pre-built point cloud map data with images to automatically and accurately identify static landmarks such as roads, sidewalks, and crosswalks. Our pipeline utilizes semantic segmentation of 2D images, associates semantic labels with points in point cloud maps to pinpoint locations in the physical world, and employs a confusion matrix formulation to generate a probabilistic bird's-eye view semantic map from semantic point clouds. The approach has been tested in an urban area with different segmentation networks to generate a semantic map with road features. The resulting map provides a rich context of the environment that is valuable for downstream tasks such as trajectory generation and intent prediction. Moreover, it has the potential to be extended to the automatic generation of HD maps for semantic features. The entire software pipeline is implemented in the robot operating system (ROS), a widely used robotics framework, and made available."
"Local Path Dynamic Programming Algorithm for Automatic Row Alignment Traveling of Wine Grape Harvester","ACM SIGAPL APL QUOTE QUAD","1993","Sniedovich, Moshe","10.1145/173834.173835","40727313","In software engineering, models are used for many different things. In this paper, we focus on program verification, where we use models to reason about the correctness of systems. There are many different types of program verification techniques which provide different correctness guarantees. We investigate the domain of program verification tools and present a concise megamodel to distinguish these tools. We also present a data set of 400+ program verification tools. This data set includes the category of verification tool according to our megamodel, practical information such as input/output format, repository links and more. The practical information, such as last commit date, is kept up to date through the use of APIs. Moreover, part of the data extraction has been automated to make it easier to expand the data set. The categorisation enables software engineers to find suitable tools, investigate alternatives and compare tools. We also identify trends for each level in our megamodel. Our data set, publicly available at https://doi.org/10.4121/20347950, can be used by software engineers to enter the world of program verification and find a verification tool based on their requirements. This paper is an extended version of https://doi.org/10.1145/3550355.3552426."
"Decision planning for intelligent vehicles in obstacle avoidance using APF-QP methods: M. Ma et al.","INTERNATIONAL JOURNAL OF DYNAMICS AND CONTROL","2025","Ma, Minrui; Huang, Bin; Ma, Liutao; Yang, Xu","10.1007/s40435-025-01924-y","40558346","This paper presents an enhanced artificial lemming algorithm (EALA) for solving complex unmanned aircraft system (UAV) path planning problems in three-dimensional environments. Key improvements include chaotic initialization, adaptive perturbation, and hybrid mutation, enabling a better exploration-exploitation balance and local refinement. Validation on the IEEE CEC2017 and CEC2022 benchmark functions demonstrates the EALA's superior performance, achieving faster convergence and better algorithm performance compared to the standard ALA and 10 other algorithms. When applied to UAV path planning in large- and medium-scale environments with realistic obstacle constraints, the EALA generates Pareto-optimal paths that minimize length, curvature, and computation time while guaranteeing collision avoidance. Benchmark tests and realistic simulations show that the EALA outperforms 10 algorithms. This method is particularly suited for mission-critical applications with strict safety and time constraints."
"Historical improvement optimal motion planning with model predictive trajectory optimization for on-road autonomous vehicle","JURNAL REKAYASA ELEKTRIKA","2024","Subiyanto, Subiyanto; Hangga, Arimaz; Bahatmaka, Aldias; Salim, Nur Azis; Sutrisno, Deyndrawan; Yunus, Elfandy; Budi Arif Prabowo, Setya; Hilmi Farras, Muhammad; Sanggrahita, Diadora","10.17529/jre.v20i3.39281",,
"HD-Maps in autonomous driving","INTERNATIONAL JOURNAL OF HIGHWAY ENGINEERING","2022","Park, Goan; Kim, Dokyun; Haider, Ibrahim; Choi, Jihyang","10.7855/ijhe.2022.24.2.041",,
"Open-pit map: An HD map data model for Open-pit mines","APPLIED SCIENCES","2023","Xu, Xingliang; Wang, Zhuo; Huang, Pengli; Tian, Suchuan; Bi, Lin","10.3390/app132312681","41282813","Abstract

UNLABELLED
Plasmids are extrachromosomal mobile genetic elements that often carry genes responsible for antimicrobial resistance. Plasmid epidemiology aims to track the evolution and spread of plasmids, but the field currently faces significant barriers that make practical implementation using whole genome sequence data difficult. Hybrid-assembled genomes remain the most reliable way to identify and track complete plasmids; however, most genomic surveillance data exists in the form of short-read sequencing, which lacks the resolution required to accurately resolve plasmids. Despite recent advances, long-read-only assemblies have not yet reached the consistency seen in hybrid assemblies. The ideal approach to plasmid epidemiology using whole genome sequence data would consider the limitations of sequencing technologies and the constraints of existing genomic surveillance infrastructure, in addition to the unique evolutionary biology of plasmids. Here, we present ACCIO (Assembly-based Circular Contig Identification for Outbreaks), a tool which creates a reference plasmid database and uses it to infer which plasmids, and genetically related plasmid groupings, are present in an input assembly (Illumina, Nanopore, or hybrid assembly). We validated ACCIO using an internal dataset of 303 plasmid-harboring bacterial clinical and surveillance isolates collected from a single acute tertiary care center. When highly related database plasmids were grouped together, ACCIO achieved 100% sensitivity and 92.1% positive predictive value (PPV) for detection of plasmid groups using hybrid assemblies, and comparably strong performance for Illumina (93.0% sensitivity, 86.6% PPV) and Nanopore (79.3% sensitivity, 91.4% PPV) assemblies. Evaluation on three external datasets yielded consistently high performance. Finally, when benchmarked against MOB-suite, a tool for reconstruction and typing of plasmids, ACCIO demonstrated superior performance across nearly all assembly types and plasmid grouping levels. By integrating database construction, clustering, and plasmid calling into a single workflow compatible with all major sequencing platforms, ACCIO is intended to help advance plasmid epidemiology beyond its current technological and infrastructural barriers.

IMPACT STATEMENT
3.Detecting and tracking plasmids-the mobile genetic elements often responsible for spreading antimicrobial resistance in hospital settings-is challenging, particularly when relying on short-read sequencing data alone. Short-read genome assemblies, despite widespread use in surveillance of bacterial pathogens, inherently lack the resolution required for plasmid analyses. Current bioinformatic methods struggle to identify whole plasmids from short-read assemblies alone, and often, hybrid assembly using both short- and long-read data is required for the robust analyses that are essential for tracking plasmids.To address these challenges, we developed ACCIO, a bioinformatics tool which utilizes input genome assemblies (short-read, long-read, or hybrid assemblies) to assess the plasmid content of clinical bacterial isolates for epidemiologic purposes. We validated its use against the recovery of circular plasmid sequences from hybrid assembled genomes as a gold standard method for determining plasmid content. Using a curated local database of 430 plasmid sequences, ACCIO provided accurate inferences of plasmid content from short-read (Illumina), long-read (Oxford Nanopore Technologies), and hybrid assemblies (both), ultimately facilitating genomic surveillance of plasmids regardless of sequencing technology. This work represents a meaningful step forward in advancing plasmid surveillance beyond the technological and infrastructural barriers that limit its broader expansion into healthcare and other settings.

DATA SUMMARY
4.Short- and long-read sequencing data have been deposited in the NCBI Sequence Read Archive (SRA) under multiple BioProjects, and corresponding hybrid genome assemblies are available in GenBank. Accession numbers for all BioProjects, BioSamples, and SRA datasets are provided in Supplementary Data S1. All supporting data, software code, and experimental/analysis protocols are provided within the article or in supplementary data files. External validation of ACCIO used three external datasets (Cho et al. 2023, BioProjects PRJNA475751 and PRJNA874473, DOI: 10.1038/s41598-024-70540-1; Lipworth et al. 2024, BioProject: PRJNA604975, DOI: 10.1038/s41467-024-45761-7; Khezri et al. 2021, European Nucleotide Archive (ENA): PRJEB45084, DOI: 10.3390/microorganisms9122560).List of External Software:: MOB-suite (v3.1.9) - https://github.com/phac-nml/mob-suite Skani (v0.2.2) - https://github.com/bluenote-1577/skani Scipy (v1.16.1) - https://github.com/scipy/scipy Pling (v2.0.0) - https://github.com/iqbal-lab-org/pling MUMmer / NUCmer (v4.0.1) - https://mummer4.github.io/ Mash / Mash Screen (v2.3) - https://github.com/marbl/Mash SPAdes (v3.15.5) - https://github.com/ablab/spades Unicycler (v0.5.1) - https://github.com/rrwick/Unicycler Flye (v2.9.5) - https://github.com/mikolmogorov/Flye QUAST (v5.2.0) - https://github.com/ablab/quast Kraken2 (v2.1.3) - https://github.com/DerrickWood/kraken2 CheckM (v0.4) - https://github.com/Ecogenomics/CheckM Albacore/Guppy - [no longer officially hosted; was distributed by ONT] Guppy - https://nanoporetech.com/software/other/guppy Dorado - https://github.com/nanoporetech/dorado Bowtie2 (v2.5.4) - https://github.com/BenLangmead/bowtie2 Minimap2 (v2.28) - https://github.com/lh3/minimap2 Biopython (v1.85) - https://biopython.org/ Pandas (v2.3.1) - https://pandas.pydata.org/ Plasme (v1.1) - https://github.com/HubertTang/PLASMe BLAST(v2.17.0) - https://blast.ncbi.nlm.nih.gov/Blast.cgi."
"with Learning Based Trajectory Prediction in Self Driving","JOURNAL OF COMPUTATIONAL AND COGNITIVE ENGINEERING","2025","Sangapu, Sreenivasa Chakravarthi; Venkadesh, Amirthavarshini; Toleti, Jayant; Sehar, Sountharrajan","10.47852/bonviewjcce52025911","41159730","Cancer stem cells (CSCs) are a subpopulation of tumor cells with self-renewal capacity and the ability to drive tumor growth, metastasis, and relapse. They are widely recognized as major contributors to therapeutic resistance. Despite extensive efforts to characterize and target CSCs, their elusive nature continues to drive therapeutic resistance and relapse in epithelial malignancies. Single-cell RNA sequencing (scRNA-seq) has transformed our understanding of tumor biology. It enables high-resolution profiling of rare subpopulations (<5%) and reveals the functional heterogeneity that contributes to treatment failure. In this review, we discuss evolving evidence for a paradigm shift, enabled by rapidly advancing single-cell technologies, from a static, marker-based definition of CSCs to a dynamic and functional perspective. We explore how trajectory inference and spatial transcriptomics redefine stemness by context-dependent dynamic-state modelling. We also highlight emerging platforms, including artificial intelligence-driven predictive modelling, multi-omics integration, and functional CRISPR screens. These approaches have the potential to uncover new vulnerabilities in CSC populations. Together, these advances should lead to new precision medicine strategies for disrupting CSC plasticity, niche adaptation, and immune evasion."
"A Personalized Motion Planning Method with Driver Characteristics in Longitudinal and Lateral Directions","ELECTRONICS","2023","Zeng, Di; Zheng, Ling; Li, Yinong; Zeng, Jie; Wang, Kan","10.3390/electronics12245021","41282813","Abstract

UNLABELLED
Plasmids are extrachromosomal mobile genetic elements that often carry genes responsible for antimicrobial resistance. Plasmid epidemiology aims to track the evolution and spread of plasmids, but the field currently faces significant barriers that make practical implementation using whole genome sequence data difficult. Hybrid-assembled genomes remain the most reliable way to identify and track complete plasmids; however, most genomic surveillance data exists in the form of short-read sequencing, which lacks the resolution required to accurately resolve plasmids. Despite recent advances, long-read-only assemblies have not yet reached the consistency seen in hybrid assemblies. The ideal approach to plasmid epidemiology using whole genome sequence data would consider the limitations of sequencing technologies and the constraints of existing genomic surveillance infrastructure, in addition to the unique evolutionary biology of plasmids. Here, we present ACCIO (Assembly-based Circular Contig Identification for Outbreaks), a tool which creates a reference plasmid database and uses it to infer which plasmids, and genetically related plasmid groupings, are present in an input assembly (Illumina, Nanopore, or hybrid assembly). We validated ACCIO using an internal dataset of 303 plasmid-harboring bacterial clinical and surveillance isolates collected from a single acute tertiary care center. When highly related database plasmids were grouped together, ACCIO achieved 100% sensitivity and 92.1% positive predictive value (PPV) for detection of plasmid groups using hybrid assemblies, and comparably strong performance for Illumina (93.0% sensitivity, 86.6% PPV) and Nanopore (79.3% sensitivity, 91.4% PPV) assemblies. Evaluation on three external datasets yielded consistently high performance. Finally, when benchmarked against MOB-suite, a tool for reconstruction and typing of plasmids, ACCIO demonstrated superior performance across nearly all assembly types and plasmid grouping levels. By integrating database construction, clustering, and plasmid calling into a single workflow compatible with all major sequencing platforms, ACCIO is intended to help advance plasmid epidemiology beyond its current technological and infrastructural barriers.

IMPACT STATEMENT
3.Detecting and tracking plasmids-the mobile genetic elements often responsible for spreading antimicrobial resistance in hospital settings-is challenging, particularly when relying on short-read sequencing data alone. Short-read genome assemblies, despite widespread use in surveillance of bacterial pathogens, inherently lack the resolution required for plasmid analyses. Current bioinformatic methods struggle to identify whole plasmids from short-read assemblies alone, and often, hybrid assembly using both short- and long-read data is required for the robust analyses that are essential for tracking plasmids.To address these challenges, we developed ACCIO, a bioinformatics tool which utilizes input genome assemblies (short-read, long-read, or hybrid assemblies) to assess the plasmid content of clinical bacterial isolates for epidemiologic purposes. We validated its use against the recovery of circular plasmid sequences from hybrid assembled genomes as a gold standard method for determining plasmid content. Using a curated local database of 430 plasmid sequences, ACCIO provided accurate inferences of plasmid content from short-read (Illumina), long-read (Oxford Nanopore Technologies), and hybrid assemblies (both), ultimately facilitating genomic surveillance of plasmids regardless of sequencing technology. This work represents a meaningful step forward in advancing plasmid surveillance beyond the technological and infrastructural barriers that limit its broader expansion into healthcare and other settings.

DATA SUMMARY
4.Short- and long-read sequencing data have been deposited in the NCBI Sequence Read Archive (SRA) under multiple BioProjects, and corresponding hybrid genome assemblies are available in GenBank. Accession numbers for all BioProjects, BioSamples, and SRA datasets are provided in Supplementary Data S1. All supporting data, software code, and experimental/analysis protocols are provided within the article or in supplementary data files. External validation of ACCIO used three external datasets (Cho et al. 2023, BioProjects PRJNA475751 and PRJNA874473, DOI: 10.1038/s41598-024-70540-1; Lipworth et al. 2024, BioProject: PRJNA604975, DOI: 10.1038/s41467-024-45761-7; Khezri et al. 2021, European Nucleotide Archive (ENA): PRJEB45084, DOI: 10.3390/microorganisms9122560).List of External Software:: MOB-suite (v3.1.9) - https://github.com/phac-nml/mob-suite Skani (v0.2.2) - https://github.com/bluenote-1577/skani Scipy (v1.16.1) - https://github.com/scipy/scipy Pling (v2.0.0) - https://github.com/iqbal-lab-org/pling MUMmer / NUCmer (v4.0.1) - https://mummer4.github.io/ Mash / Mash Screen (v2.3) - https://github.com/marbl/Mash SPAdes (v3.15.5) - https://github.com/ablab/spades Unicycler (v0.5.1) - https://github.com/rrwick/Unicycler Flye (v2.9.5) - https://github.com/mikolmogorov/Flye QUAST (v5.2.0) - https://github.com/ablab/quast Kraken2 (v2.1.3) - https://github.com/DerrickWood/kraken2 CheckM (v0.4) - https://github.com/Ecogenomics/CheckM Albacore/Guppy - [no longer officially hosted; was distributed by ONT] Guppy - https://nanoporetech.com/software/other/guppy Dorado - https://github.com/nanoporetech/dorado Bowtie2 (v2.5.4) - https://github.com/BenLangmead/bowtie2 Minimap2 (v2.28) - https://github.com/lh3/minimap2 Biopython (v1.85) - https://biopython.org/ Pandas (v2.3.1) - https://pandas.pydata.org/ Plasme (v1.1) - https://github.com/HubertTang/PLASMe BLAST(v2.17.0) - https://blast.ncbi.nlm.nih.gov/Blast.cgi."
"Path planning of autonomous driving based on quadratic optimization","IOP CONFERENCE SERIES: MATERIALS SCIENCE AND ENGINEERING","2019","Ma, T Z; Chen, H; Li, K; Peng, M","10.1088/1757-899x/563/5/052078",,
"Mpnp: Multi-policy neural planner for urban driving","VEHICLE SYSTEM DYNAMICS","2023","Micheli, F.; Bersani, M.; Arrigoni, S.; Braghin, F.; Cheli, F.","10.1080/00423114.2022.2081220","41246084","Microplastics (MPs) and nanoplastics (NPs) have become pervasive contaminants in food, water, and air, leading to widespread human exposure, primarily through ingestion. Although MPs are increasingly detected in human tissues, including the placenta, blood, and brain, their long-term health implications are poorly understood. This review compiles emerging evidence on the systemic distribution and biological effects of ingested MPs, particularly on neurological risks. MPs can disrupt gut microbiota, breach intestinal and blood-brain barriers, and accumulate in neural tissues. Mechanistic studies reveal that MPs induce oxidative stress, neuroinflammation, protein aggregation, and neurotransmitter alterations, which may contribute to the development of cognitive dysfunction and neurodegenerative disease pathways. Recent work using brain organoids, single-cell and multi-omics technologies provides deeper mechanistic insights, linking MP/NP exposure to mitochondrial injury, inflammatory signaling, and impaired protein homeostasis. We also identify important gaps in exposure assessment, NPs detection, and epidemiological evidence. Human studies remain scarce but initial reports associating elevated MP/NP burdens in brain tissue with dementia highlight the urgency of this research. To address these gaps, we suggest critical next steps in the research agenda, integrating omics technologies, real-world exposure models, and human-relevant in vitro systems. As MP contamination grows, it is critical to understand its neurotoxic potential for informing public health policy and protecting vulnerable populations."
